{
  "kind": "measurement_feedback",
  "schema_version": "1.0.0",
  "feedback_id": "mf_0001",
  "feedback_version": "1.0.0",
  "release_ref": {
    "id": "rel_seed_web_0001",
    "version": "1.0.0"
  },
  "release_checksum": "sha256:5c113f4390e4c615aa94eb5fa359a11a7178f861f92987b98fa4788525677608",
  "model_version": {
    "id": "affinity_centroid_v1",
    "version": "1.0.0"
  },
  "feature_versions": [
    {
      "id": "fp_seed_web",
      "version": "1.0.0"
    }
  ],
  "output_unit": {
    "type_id": "browser_cookie",
    "type_version": "1.0.0",
    "namespace": "web_demo_cookie"
  },
  "measurement_unit": {
    "type_id": "browser_cookie",
    "type_version": "1.0.0",
    "namespace": "web_demo_cookie"
  },
  "mapping_refs": [],
  "campaign_context_ref": "campaign_demo_q4",
  "design": {
    "design_type": "randomized_holdout",
    "assignment_ref": {
      "id": "assignment_demo_q4",
      "version": "1.0.0"
    },
    "primary_estimand": "intention_to_treat",
    "estimator": "Difference in conversion rate between assigned groups",
    "assumptions": [
      "Random assignment at the cookie level",
      "No interference between units"
    ]
  },
  "exposure_ref": {
    "id": "exposure_log_demo_q4",
    "version": "1.0.0"
  },
  "outcome_definition": {
    "event": "conversion",
    "unit": {
      "type_id": "browser_cookie",
      "type_version": "1.0.0",
      "namespace": "web_demo_cookie"
    }
  },
  "observation_window": {
    "start": "2026-10-13T00:00:00Z",
    "end": "2026-11-12T00:00:00Z"
  },
  "available_at": "2026-11-14T00:00:00Z",
  "maturity": "mature",
  "population_coverage": {
    "observable": {
      "value": 96000,
      "unit": {
        "type_id": "browser_cookie",
        "type_version": "1.0.0",
        "namespace": "web_demo_cookie"
      },
      "basis": "exact"
    },
    "agreed": {
      "value": 118400,
      "unit": {
        "type_id": "browser_cookie",
        "type_version": "1.0.0",
        "namespace": "web_demo_cookie"
      },
      "basis": "exact"
    }
  },
  "results": [
    {
      "name": "itt_conversion_rate_difference",
      "value": 0.0021,
      "denominator": {
        "value": 96000,
        "unit": {
          "type_id": "browser_cookie",
          "type_version": "1.0.0",
          "namespace": "web_demo_cookie"
        },
        "basis": "exact"
      },
      "population_ref": "pop_assigned_observable",
      "uncertainty": {
        "method": "normal_approximation",
        "level": 0.95,
        "lower": 0.0004,
        "upper": 0.0038
      }
    }
  ],
  "claim_type": "experimental_effect",
  "permitted_future_training_use": false,
  "reuse_rights_ref": null
}
